{
  "target": {"input": "targets/owasp-benchmark-python", "commit": "f1291485808b66e20ddb6b01b10dc71b3df8c8ba"},
  "scan": {"bandit_version": "1.9.4", "min_severity": "MEDIUM", "alert_count": 3},
  "budget": {"max_tokens": 20000, "used_tokens": 19480, "exhausted": true},
  "alerts": [
    {
      "alert_id": "owasp-BenchmarkTest00073-py-54-B307",
      "test_id": "B307",
      "path": "testcode/BenchmarkTest00073.py",
      "line": 54,
      "severity": "MEDIUM",
      "confidence": "HIGH",
      "label": 1,
      "status": "classified",
      "rationale": "Format illustration only: one or two sentences citing what the agent read.",
      "evidence": [{"path": "testcode/BenchmarkTest00073.py", "start_line": 45, "end_line": 58}],
      "remediation": {
        "status": "accepted",
        "diff": "--- a/testcode/BenchmarkTest00073.py\n+++ b/testcode/BenchmarkTest00073.py\n@@ -17,3 +17,4 @@\n \n+import ast\n from flask import redirect, url_for, request, make_response, render_template\n from helpers.utils import escape_for_html\n@@ -52,5 +53,5 @@\n \t\ttry:\n \t\t\tRESPONSE += (\n-\t\t\t\teval(bar)\n+\t\t\t\tast.literal_eval(bar)\n \t\t\t)\n \t\texcept:\n",
        "checks": {"applies": true, "touches_flagged_line": true, "clean_rescan": true}
      }
    },
    {
      "alert_id": "owasp-BenchmarkTest00074-py-51-B102",
      "test_id": "B102",
      "path": "testcode/BenchmarkTest00074.py",
      "line": 51,
      "severity": "MEDIUM",
      "confidence": "HIGH",
      "label": null,
      "status": "error",
      "rationale": "The model reply could not be parsed as a label.",
      "evidence": [],
      "remediation": {
        "status": "skipped",
        "diff": "",
        "checks": {"applies": null, "touches_flagged_line": null, "clean_rescan": null}
      }
    },
    {
      "alert_id": "owasp-BenchmarkTest00078-py-53-B301",
      "test_id": "B301",
      "path": "testcode/BenchmarkTest00078.py",
      "line": 53,
      "severity": "MEDIUM",
      "confidence": "HIGH",
      "label": null,
      "status": "budget_exhausted",
      "rationale": "",
      "evidence": [],
      "remediation": {
        "status": "skipped",
        "diff": "",
        "checks": {"applies": null, "touches_flagged_line": null, "clean_rescan": null}
      }
    }
  ]
}
